{
	"title": "Engineering Manager (Promoted from Senior)",
	"organization": {
		"name": "Zapp",
		"url": "https://justzapp.com",
		"linkEnabled": true
	},
	"employmentType": "Full-time",
	"location": "London",
	"duration": "(1 year 8 months)",
	"dynamicDuration": true,
	"dates": {
		"start": {
			"datetime": "2024-12-16",
			"label": "12/2024"
		},
		"end": {
			"datetime": "present",
			"label": "Present"
		}
	}
}
