{
	"title": "Computer Lecturer",
	"organization": {
		"name": "Teacher",
		"url": "",
		"linkEnabled": false
	},
	"employmentType": "Part-time",
	"location": "IR",
	"duration": "(11 years 4 months)",
	"dynamicDuration": false,
	"dates": {
		"start": {
			"datetime": "2006-06",
			"label": "06/2006"
		},
		"end": {
			"datetime": "2017-09",
			"label": "09/2017"
		}
	}
}
