{
	"title": "Engineering Manager, Consumer",
	"organization": {
		"name": "Zapp",
		"url": "https://justzapp.com",
		"linkEnabled": true
	},
	"employmentType": "Full-time",
	"location": "London",
	"duration": "(4 months)",
	"dynamicDuration": true,
	"dates": {
		"start": {
			"datetime": "2026-04-13",
			"label": "04/2026"
		},
		"end": {
			"datetime": "present",
			"label": "Present"
		}
	}
}
