{
	"title": "Co-Founder & CEO",
	"organization": {
		"name": "Sarshomar",
		"url": "https://sarshomar.com/",
		"linkEnabled": true
	},
	"employmentType": "Full-time",
	"location": "IR",
	"duration": "(2 years 4 months)",
	"dynamicDuration": false,
	"dates": {
		"start": {
			"datetime": "2015-06-22",
			"label": "06/2015"
		},
		"end": {
			"datetime": "2019-09-07",
			"label": "09/2017"
		}
	}
}
