{
	"title": "Co-Founder & CTO",
	"organization": {
		"name": "Jibres",
		"url": "https://jibres.com",
		"linkEnabled": true
	},
	"employmentType": "Full-time",
	"location": "IR",
	"duration": "(3 years)",
	"dynamicDuration": false,
	"dates": {
		"start": {
			"datetime": "2019-12-06",
			"label": "12/2019"
		},
		"end": {
			"datetime": "2022-11",
			"label": "11/2022"
		}
	}
}
