{
	"title": "Head of Engineering",
	"organization": {
		"name": "Ermile",
		"url": "https://ermile.com/",
		"linkEnabled": true
	},
	"employmentType": "Full-time",
	"location": "IR",
	"duration": "(1 year 5 months)",
	"dynamicDuration": false,
	"dates": {
		"start": {
			"datetime": "2018-08-07",
			"label": "08/2018"
		},
		"end": {
			"datetime": "2019-12-06",
			"label": "12/2019"
		}
	}
}
